{
  "$schema": "../schemas/catalog.schema.json",
  "families": [
    {
      "$schema": "../../schemas/family.schema.json",
      "aliases": [
        "Acreed Stealer"
      ],
      "attribution_confidence": "high",
      "classification": "known_family",
      "description": "The observed Acreed sample stores system metadata in `pc_info.json` as a structured JSON object with PascalCase keys such as `PcName`, `ScreenSize`, `CpuCores`, and `IsElevator`.",
      "external_references": [
        {
          "title": "Analysis of Acreed, a rising infostealer",
          "url": "https://www.intrinsec.com/wp-content/uploads/2025/10/TLP-CLEAR-Sept-2025-Acreed-infostealer-EN.pdf"
        },
        {
          "title": "Acreed Infostealer",
          "url": "https://www.broadcom.com/support/security-center/protection-bulletin/acreed-infostealer"
        }
      ],
      "id": "acreed",
      "name": "Acreed",
      "schema_version": "1.0",
      "targets": [
        "Browser saved credentials, cookies, autofill",
        "Crypto wallet extensions and desktop clients",
        "Discord and Telegram session data",
        "Document grabber for sensitive file types"
      ],
      "tracking_labels": []
    },
    {
      "$schema": "../../schemas/family.schema.json",
      "aliases": [
        "Ailurophile Stealer"
      ],
      "attribution_confidence": "high",
      "classification": "known_family",
      "description": "Ailurophile logs are recognized by `info.txt` and the combined fields `PC Type`, `File Path`, `Main Path`, `MAC Address`, and browser-version lines such as `Chrome Default - version`.",
      "external_references": [
        {
          "url": "https://github.com/ail-project/ail-yara-rules/blob/master/rules/stealer/ailurophile.yara"
        },
        {
          "url": "https://www.cyfirma.com/research/ailurophile-stealer/"
        }
      ],
      "id": "ailurophile",
      "name": "Ailurophile",
      "schema_version": "1.0",
      "targets": [
        "Browser saved credentials, cookies, autofill, history",
        "Credit card data from browser autofill",
        "Crypto wallet extensions and desktop clients",
        "Generic file grabber driven by configurable keyword and extension lists"
      ],
      "tracking_labels": []
    },
    {
      "$schema": "../../schemas/family.schema.json",
      "aliases": [
        "AMOS",
        "Atomic Mac",
        "Atomic Stealer",
        "Atomic macOS Stealer"
      ],
      "attribution_confidence": "medium",
      "classification": "known_family",
      "description": "The observed AMOS sample uses `userinformation.txt`. It opens with `MetaMask Info:` and `Debanks:`, then presents `Userinfo:` and macOS system, hardware, and display sections.",
      "external_references": [
        {
          "url": "https://cyble.com/blog/threat-actor-selling-new-atomic-macos-amos-stealer-on-telegram/"
        },
        {
          "url": "https://github.com/MalBeacon/what-is-this-stealer"
        },
        {
          "url": "https://moonlock.com/atomic-macos-stealer"
        },
        {
          "url": "https://www.bleepingcomputer.com/news/security/new-atomic-macos-info-stealing-malware-targets-50-crypto-wallets/"
        },
        {
          "url": "https://www.esentire.com/blog/fake-deepseek-site-infects-mac-users-with-atomic-stealer"
        },
        {
          "url": "https://www.picussecurity.com/resource/blog/atomic-stealer-amos-macos-threat-analysis"
        },
        {
          "url": "https://www.sentinelone.com/blog/atomic-stealer-threat-actor-spawns-second-variant-of-macos-malware-sold-on-telegram/"
        }
      ],
      "id": "amos-stealer",
      "name": "AMOS Stealer",
      "schema_version": "1.0",
      "targets": [
        "Apple Notes content and Telegram session files",
        "Browser saved credentials, cookies, autofill, history",
        "Crypto wallet extensions (MetaMask, Phantom, Coin98, Trust Wallet, 50+ targeted)",
        "Desktop crypto wallets (Electrum, Exodus, Atomic, Wasabi, Ledger Live, Trezor Suite)",
        "Documents and Desktop file grabber (.txt, .pdf, .docx, .wallet, .key)",
        "macOS Keychain database and login password (AppleScript prompt)"
      ],
      "tracking_labels": []
    },
    {
      "$schema": "../../schemas/family.schema.json",
      "aliases": [
        "Arcane Stealer"
      ],
      "attribution_confidence": "high",
      "classification": "known_family",
      "description": "Arcane logs are recognized by `information.txt` and the combined `Worker`, `Date Install`, `External IP`, `Internal IP`, and `Gateway IP` fields. The observed layout continues with `=== ... Information ===` hardware and system sections. Public reporting describes VGS Stealer as a predecessor, not an Arcane alias.",
      "external_references": [
        {
          "url": "https://cyberinsider.com/new-arcane-stealer-malware-targets-vpn-accounts-via-youtube-cheats/"
        },
        {
          "url": "https://securelist.com/arcane-stealer/115919/"
        },
        {
          "url": "https://thehackernews.com/2025/03/youtube-game-cheats-spread-arcane.html"
        },
        {
          "url": "https://www.bleepingcomputer.com/news/security/new-arcane-infostealer-infects-youtube-discord-users-via-game-cheats/"
        }
      ],
      "id": "arcane",
      "name": "Arcane",
      "schema_version": "1.0",
      "targets": [
        "Browser DPAPI keys cracked via embedded xaitax utility",
        "Browser saved credentials, cookies, autofill, history (Chromium and Gecko)",
        "Cryptocurrency wallets",
        "Gaming client tokens (Riot Client, Epic, Steam, Ubisoft Connect, Roblox, Battle.net)",
        "Network utility configs (ngrok, Playit, Cyberduck, FileZilla, DynDNS)",
        "System hardware inventory and saved Wi-Fi networks",
        "Telegram and Discord session data",
        "VPN client configs (OpenVPN, Mullvad, NordVPN, IPVanish, Surfshark, Proton, hide.me, PIA, CyberGhost, ExpressVPN)"
      ],
      "tracking_labels": []
    },
    {
      "$schema": "../../schemas/family.schema.json",
      "aliases": [
        "Aura Stealer",
        "AuraStealer"
      ],
      "attribution_confidence": "high",
      "classification": "known_family",
      "description": "The observed AuraStealer sample uses `system.txt`, headed `AURA v1.5.2`. Its layout separates `[System Info]`, `[Hardware]`, `[Processes List]`, and `[Installed Software]`.",
      "external_references": [
        {
          "url": "https://malpedia.caad.fkie.fraunhofer.de/details/win.aurastealer"
        },
        {
          "url": "https://www.gendigital.com/blog/insights/research/defeating-aurastealer-obfuscation"
        },
        {
          "url": "https://www.intrinsec.com/en/analysis-of-aurastealer-an-emerging-infostealer/"
        },
        {
          "url": "https://www.microsoft.com/en-us/wdsi/threats/malware-encyclopedia-description?Name=Trojan:MSIL/AuraStealer.AUKB!MTB&ThreatID=2147957435"
        }
      ],
      "id": "aura-stealer",
      "name": "AuraStealer",
      "schema_version": "1.0",
      "targets": [
        "Authenticator and 2FA app data (70+ apps)",
        "Browser saved credentials, cookies, autofill (110+ browsers)",
        "Crypto wallet extensions and desktop clients (250+ extensions)",
        "System hardware and installed-software inventory"
      ],
      "tracking_labels": []
    },
    {
      "$schema": "../../schemas/family.schema.json",
      "aliases": [
        "Blank-c/Blank-Grabber",
        "BlankGrabber"
      ],
      "attribution_confidence": "high",
      "classification": "known_family",
      "description": "Blank Grabber logs are recognized as `information.txt` or `system.txt` by fields such as `Cellular Network`, `Computer OS`, `Discord Accounts`, `Roblox Cookies`, and `Wifi Passwords`. The observed layout groups them under `IP Info`, `System Info`, and `Grabbed Info`.",
      "external_references": [
        {
          "url": "https://any.run/malware-trends/blankgrabber/"
        },
        {
          "url": "https://www.splunk.com/en_us/blog/security/blankgrabber-trojan-stealer-analysis-detection.html"
        }
      ],
      "id": "blank-grabber",
      "name": "Blank Grabber",
      "schema_version": "1.0",
      "targets": [
        "Browser saved credentials, cookies, history, autofill",
        "Crypto wallet desktop clients (Bitcoin, Ethereum, Exodus, others)",
        "Discord and Telegram session tokens",
        "Game launcher sessions (Epic, Steam, Uplay, Battle.net, Growtopia)",
        "Roblox cookies and Minecraft sessions",
        "System hardware and locale inventory",
        "Wifi passwords and webcam captures"
      ],
      "tracking_labels": []
    },
    {
      "$schema": "../../schemas/family.schema.json",
      "aliases": [
        "Crypt Bot",
        "CryptBot Stealer"
      ],
      "attribution_confidence": "high",
      "classification": "known_family",
      "description": "CryptBot's `_Information.txt` is an aligned key/value summary combining `OS`, `Keyboard Languages`, `CPU`, `RAM`, `GPU`, `Display Resolution`, and `Installed software` fields.",
      "external_references": [
        {
          "url": "https://any.run/malware-trends/cryptbot/"
        },
        {
          "url": "https://fr3d.hk/blog/cryptbot-too-good-to-be-true"
        },
        {
          "url": "https://malpedia.caad.fkie.fraunhofer.de/details/win.cryptbot"
        },
        {
          "url": "https://research.openanalysis.net/cryptbot/botnet/yara/config/2024/12/06/cryptbot2.html"
        },
        {
          "url": "https://www.deepinstinct.com/blog/cryptbot-how-free-becomes-a-high-price-to-pay"
        }
      ],
      "id": "crypt-bot",
      "name": "CryptBot",
      "schema_version": "1.0",
      "targets": [
        "Browser cookies and autofill data",
        "Browser saved credentials (Chromium and Gecko)",